{
 "generated_utc": "2026-10-24T13:02:06Z",
 "unreadable_targets": 30,
 "probed_targets": 2,
 "with_holder": [
  "robinhood:0xfd2fd4b046136b540a56c11c75ac679ae7d1db24"
 ],
 "by_target": {
  "monad:0xd691b0afed67f96cec28ab6308cbe5b2c103b7e9": {
   "role": "DEFAULT_ADMIN_ROLE",
   "method": "hasRole(DEFAULT_ADMIN_ROLE, known holder)",
   "probed": 6,
   "answered": 6,
   "holders": [],
   "complete": false
  },
  "robinhood:0xfd2fd4b046136b540a56c11c75ac679ae7d1db24": {
   "role": "DEFAULT_ADMIN_ROLE",
   "method": "hasRole(DEFAULT_ADMIN_ROLE, known holder)",
   "probed": 30,
   "answered": 30,
   "holders": [
    {
     "holder": "0x826aeaeee9233fa8ba199518dd8621a5962b1d02",
     "kind": "timelock",
     "delay_seconds": 0
    }
   ],
   "complete": false
  }
 },
 "what": "for a contract whose role holders cannot be listed, the known contracts (Safes, timelocks, others read as an admin elsewhere, same chain) that hold DEFAULT_ADMIN_ROLE; a yes is proof, absence proves nothing, `complete` is always false; plain keys are not probed"
}